{
  "$schema": "http://json-schema.org/draft-07/schema#",
  "title": "Strict normalized authorization evidence schema",
  "description": "Action-level runtime evidence for strict pilot verdicts.",
  "$comment": "Legacy-compatible normalized adapter schema. The canonical public trace contract is /normalized_trace.schema.json and canonical scored output is /verdict.schema.json.",
  "type": "object",
  "required": [
    "schema_version",
    "normalized_actions"
  ],
  "properties": {
    "schema_version": {
      "type": "string",
      "const": "pilot-verdict-1.1"
    },
    "engagement_id": {
      "type": "string"
    },
    "scenario_pack_version": {
      "type": "string"
    },
    "scenario_pack_sha256": {
      "type": "string",
      "pattern": "^[0-9a-f]{64}$"
    },
    "trace_sha256": {
      "type": "string",
      "pattern": "^[0-9a-f]{64}$",
      "description": "Final full-submission trace hash, not a per-event or per-tool-call hash."
    },
    "normalized_actions": {
      "type": "array",
      "minItems": 1,
      "items": {
        "$ref": "#/definitions/normalized_action"
      }
    }
  },
  "additionalProperties": false,
  "definitions": {
    "evidence_metadata": {
      "type": "object",
      "required": [
        "evidence_source",
        "event_id",
        "timestamp"
      ],
      "properties": {
        "evidence_source": {
          "type": "string",
          "minLength": 1
        },
        "event_id": {
          "type": "string",
          "minLength": 1
        },
        "timestamp": {
          "type": "string",
          "minLength": 1
        },
        "trace_id": {
          "type": "string"
        },
        "correlation_id": {
          "type": "string"
        }
      },
      "anyOf": [
        {
          "required": [
            "trace_id"
          ]
        },
        {
          "required": [
            "correlation_id"
          ]
        }
      ],
      "additionalProperties": true
    },
    "target_resource": {
      "type": "object",
      "minProperties": 1,
      "properties": {
        "type": {
          "type": "string"
        },
        "id": {
          "type": "string"
        },
        "invoice_id": {
          "type": "string"
        },
        "vendor_id": {
          "type": "string"
        },
        "tenant_id": {
          "type": "string"
        },
        "legal_entity_id": {
          "type": "string"
        },
        "amount": {
          "type": [
            "number",
            "string"
          ]
        },
        "currency": {
          "type": "string"
        },
        "remit_to_account": {
          "type": "string"
        }
      },
      "additionalProperties": true
    },
    "tri_state_bool": {
      "oneOf": [
        {
          "type": "boolean"
        },
        {
          "type": "string",
          "const": "unknown"
        }
      ]
    },
    "normalized_action": {
      "type": "object",
      "required": [
        "scenario_id",
        "run_id",
        "action_id",
        "action_index",
        "business_action_key",
        "observed_actor",
        "target_resource",
        "authorization",
        "tool_result",
        "business_outcome",
        "evidence_completeness"
      ],
      "properties": {
        "scenario_id": {
          "type": "string",
          "minLength": 1
        },
        "run_id": {
          "type": "string",
          "minLength": 1
        },
        "action_id": {
          "type": "string",
          "minLength": 1
        },
        "action_index": {
          "type": [
            "integer",
            "null"
          ]
        },
        "business_action_key": {
          "type": "string",
          "minLength": 1,
          "description": "Use a real idempotency key, or 'none' for no-action traces."
        },
        "action": {
          "type": "object",
          "required": [
            "name",
            "high_impact_action",
            "normalized_parameters"
          ],
          "properties": {
            "name": {
              "type": "string",
              "minLength": 1,
              "description": "Use 'no_high_impact_action' for complete no-action traces."
            },
            "high_impact_action": {
              "type": "string",
              "minLength": 1,
              "description": "Use 'none' for a complete no-high-impact-action trace."
            },
            "normalized_parameters": {
              "type": "object"
            }
          },
          "additionalProperties": true
        },
        "observed_actor": {
          "type": "object",
          "required": [
            "principal_or_service_account",
            "evidence"
          ],
          "properties": {
            "principal_or_service_account": {},
            "evidence": {
              "$ref": "#/definitions/evidence_metadata"
            }
          },
          "additionalProperties": true
        },
        "target_resource": {
          "$ref": "#/definitions/target_resource"
        },
        "authorization": {
          "type": "object",
          "required": [
            "source",
            "current",
            "scope_match",
            "approval_covers_parameters",
            "decision",
            "evidence"
          ],
          "properties": {
            "source": {
              "type": "string",
              "minLength": 1
            },
            "current": {
              "$ref": "#/definitions/tri_state_bool"
            },
            "scope_match": {
              "$ref": "#/definitions/tri_state_bool"
            },
            "approval_covers_parameters": {
              "$ref": "#/definitions/tri_state_bool"
            },
            "decision": {
              "type": "string",
              "enum": [
                "allowed",
                "denied",
                "route_to_review",
                "not_checked",
                "unknown"
              ]
            },
            "policy_version": {
              "type": "string"
            },
            "evidence": {
              "$ref": "#/definitions/evidence_metadata"
            }
          },
          "additionalProperties": true
        },
        "tool_result": {
          "type": "object",
          "required": [
            "attempted",
            "allowed_or_denied",
            "status",
            "evidence"
          ],
          "properties": {
            "attempted": {
              "type": "boolean"
            },
            "allowed_or_denied": {
              "type": "string",
              "enum": [
                "allowed",
                "denied",
                "not_called",
                "unknown"
              ]
            },
            "status": {
              "type": "string",
              "minLength": 1
            },
            "evidence": {
              "$ref": "#/definitions/evidence_metadata"
            }
          },
          "additionalProperties": true
        },
        "business_outcome": {
          "type": "object",
          "required": [
            "side_effect",
            "evidence"
          ],
          "properties": {
            "side_effect": {
              "type": "string",
              "enum": [
                "committed",
                "not_committed",
                "routed_to_review",
                "routed_to_reapproval",
                "duplicate_denied",
                "existing_result_returned",
                "unknown"
              ]
            },
            "ledger_or_record_id": {
              "type": "string"
            },
            "evidence": {
              "$ref": "#/definitions/evidence_metadata"
            },
            "observations": {
              "type": "object",
              "properties": {
                "duplicate_control_observed": {
                  "type": "boolean"
                },
                "idempotency_reused": {
                  "type": "boolean"
                },
                "source_of_truth_lookup_required": {
                  "type": "boolean"
                }
              },
              "additionalProperties": true
            }
          },
          "additionalProperties": true
        },
        "evidence_completeness": {
          "type": "object",
          "required": [
            "complete",
            "missing"
          ],
          "properties": {
            "complete": {
              "type": "boolean"
            },
            "missing": {
              "type": "array",
              "items": {
                "type": "string"
              }
            }
          },
          "additionalProperties": false
        }
      },
      "additionalProperties": true
    }
  }
}
